{"assignment_freeze_sha256":null,"assignment_status":"DRAFT_NOT_DISTRIBUTABLE","assignments":[{"assigned_at":null,"assignment_id":"audio-candidate-prescreen-packets-v1.task194.candidate.C03.question_claim_author_or_verifier","family_id":"task194.candidate.C03","reviewer_id":null,"role":"question_claim_author_or_verifier","source_group_id":"P27"},{"assigned_at":null,"assignment_id":"audio-candidate-prescreen-packets-v1.task194.candidate.C03.blind_alternative_evidence_finder","family_id":"task194.candidate.C03","reviewer_id":null,"role":"blind_alternative_evidence_finder","source_group_id":"P27"},{"assigned_at":null,"assignment_id":"audio-candidate-prescreen-packets-v1.task194.candidate.C03.validator_a","family_id":"task194.candidate.C03","reviewer_id":null,"role":"validator_a","source_group_id":"P27"},{"assigned_at":null,"assignment_id":"audio-candidate-prescreen-packets-v1.task194.candidate.C03.validator_b","family_id":"task194.candidate.C03","reviewer_id":null,"role":"validator_b","source_group_id":"P27"},{"assigned_at":null,"assignment_id":"audio-candidate-prescreen-packets-v1.task194.candidate.C03.adjudicator","family_id":"task194.candidate.C03","reviewer_id":null,"role":"adjudicator","source_group_id":"P27"},{"assigned_at":null,"assignment_id":"audio-candidate-prescreen-packets-v1.task194.candidate.C03.blind_post_adjudication_saturation_auditor","family_id":"task194.candidate.C03","reviewer_id":null,"role":"blind_post_adjudication_saturation_auditor","source_group_id":"P27"},{"assigned_at":null,"assignment_id":"audio-candidate-prescreen-packets-v1.task194.candidate.C04.question_claim_author_or_verifier","family_id":"task194.candidate.C04","reviewer_id":null,"role":"question_claim_author_or_verifier","source_group_id":"P28"},{"assigned_at":null,"assignment_id":"audio-candidate-prescreen-packets-v1.task194.candidate.C04.blind_alternative_evidence_finder","family_id":"task194.candidate.C04","reviewer_id":null,"role":"blind_alternative_evidence_finder","source_group_id":"P28"},{"assigned_at":null,"assignment_id":"audio-candidate-prescreen-packets-v1.task194.candidate.C04.validator_a","family_id":"task194.candidate.C04","reviewer_id":null,"role":"validator_a","source_group_id":"P28"},{"assigned_at":null,"assignment_id":"audio-candidate-prescreen-packets-v1.task194.candidate.C04.validator_b","family_id":"task194.candidate.C04","reviewer_id":null,"role":"validator_b","source_group_id":"P28"},{"assigned_at":null,"assignment_id":"audio-candidate-prescreen-packets-v1.task194.candidate.C04.adjudicator","family_id":"task194.candidate.C04","reviewer_id":null,"role":"adjudicator","source_group_id":"P28"},{"assigned_at":null,"assignment_id":"audio-candidate-prescreen-packets-v1.task194.candidate.C04.blind_post_adjudication_saturation_auditor","family_id":"task194.candidate.C04","reviewer_id":null,"role":"blind_post_adjudication_saturation_auditor","source_group_id":"P28"},{"assigned_at":null,"assignment_id":"audio-candidate-prescreen-packets-v1.task194.candidate.C02.question_claim_author_or_verifier","family_id":"task194.candidate.C02","reviewer_id":null,"role":"question_claim_author_or_verifier","source_group_id":"cc4d_p01_e08"},{"assigned_at":null,"assignment_id":"audio-candidate-prescreen-packets-v1.task194.candidate.C02.blind_alternative_evidence_finder","family_id":"task194.candidate.C02","reviewer_id":null,"role":"blind_alternative_evidence_finder","source_group_id":"cc4d_p01_e08"},{"assigned_at":null,"assignment_id":"audio-candidate-prescreen-packets-v1.task194.candidate.C02.validator_a","family_id":"task194.candidate.C02","reviewer_id":null,"role":"validator_a","source_group_id":"cc4d_p01_e08"},{"assigned_at":null,"assignment_id":"audio-candidate-prescreen-packets-v1.task194.candidate.C02.validator_b","family_id":"task194.candidate.C02","reviewer_id":null,"role":"validator_b","source_group_id":"cc4d_p01_e08"},{"assigned_at":null,"assignment_id":"audio-candidate-prescreen-packets-v1.task194.candidate.C02.adjudicator","family_id":"task194.candidate.C02","reviewer_id":null,"role":"adjudicator","source_group_id":"cc4d_p01_e08"},{"assigned_at":null,"assignment_id":"audio-candidate-prescreen-packets-v1.task194.candidate.C02.blind_post_adjudication_saturation_auditor","family_id":"task194.candidate.C02","reviewer_id":null,"role":"blind_post_adjudication_saturation_auditor","source_group_id":"cc4d_p01_e08"},{"assigned_at":null,"assignment_id":"audio-candidate-prescreen-packets-v1.task194.candidate.C01.question_claim_author_or_verifier","family_id":"task194.candidate.C01","reviewer_id":null,"role":"question_claim_author_or_verifier","source_group_id":"cc4d_p02_e02"},{"assigned_at":null,"assignment_id":"audio-candidate-prescreen-packets-v1.task194.candidate.C01.blind_alternative_evidence_finder","family_id":"task194.candidate.C01","reviewer_id":null,"role":"blind_alternative_evidence_finder","source_group_id":"cc4d_p02_e02"},{"assigned_at":null,"assignment_id":"audio-candidate-prescreen-packets-v1.task194.candidate.C01.validator_a","family_id":"task194.candidate.C01","reviewer_id":null,"role":"validator_a","source_group_id":"cc4d_p02_e02"},{"assigned_at":null,"assignment_id":"audio-candidate-prescreen-packets-v1.task194.candidate.C01.validator_b","family_id":"task194.candidate.C01","reviewer_id":null,"role":"validator_b","source_group_id":"cc4d_p02_e02"},{"assigned_at":null,"assignment_id":"audio-candidate-prescreen-packets-v1.task194.candidate.C01.adjudicator","family_id":"task194.candidate.C01","reviewer_id":null,"role":"adjudicator","source_group_id":"cc4d_p02_e02"},{"assigned_at":null,"assignment_id":"audio-candidate-prescreen-packets-v1.task194.candidate.C01.blind_post_adjudication_saturation_auditor","family_id":"task194.candidate.C01","reviewer_id":null,"role":"blind_post_adjudication_saturation_auditor","source_group_id":"cc4d_p02_e02"}],"distribution_authorized":false,"frozen_at":null,"generated_at":"2026-10-10T00:00:00+08:00","notes":"Blank six-role matrix. No identities or assignments exist. Prescreener exposure bars both blind source-search roles.","packet_id":"audio-candidate-prescreen-packets-v1","pre_distribution_exposure_snapshot_sha256":"sha256:f2e85c292047988b47619041a93a63d8c2ac7546bb2d0ecb508ea9381990108b","record_type":"construct_validation_reviewer_assignment_ledger","schema_version":"1.0.0","source_groups":[{"family_ids":["task194.candidate.C03"],"source_group_id":"P27","source_ids":["P27_101"]},{"family_ids":["task194.candidate.C04"],"source_group_id":"P28","source_ids":["P28_103"]},{"family_ids":["task194.candidate.C02"],"source_group_id":"cc4d_p01_e08","source_ids":["16_20"]},{"family_ids":["task194.candidate.C01"],"source_group_id":"cc4d_p02_e02","source_ids":["15_29"]}]}
